Frame 1: 74 bytes on wire (592 bits), 74 bytes captured (592 bits)
    Encapsulation type: Ethernet (1)
    Arrival Time: Jul 20, 2011 07:23:12.267566000 CEST
    [Time shift for this packet: 0.000000000 seconds]
    Epoch Time: 1311139392.267566000 seconds
    [Time delta from previous captured frame: 0.000000000 seconds]
    [Time delta from previous displayed frame: 0.000000000 seconds]
    [Time since reference or first frame: 0.000000000 seconds]
    Frame Number: 1
    Frame Length: 74 bytes (592 bits)
    Capture Length: 74 bytes (592 bits)
    [Frame is marked: False]
    [Frame is ignored: False]
    [Protocols in frame: eth:ethertype:ip:tcp]
Ethernet II, Src: Giga-Byt_0f:00:ad (00:24:1d:0f:00:ad), Dst: PcsCompu_cc:8a:1e (08:00:27:cc:8a:1e)
    Destination: PcsCompu_cc:8a:1e (08:00:27:cc:8a:1e)
        Address: PcsCompu_cc:8a:1e (08:00:27:cc:8a:1e)
        .... ..0. .... .... .... .... = LG bit: Globally unique address (factory default)
        .... ...0 .... .... .... .... = IG bit: Individual address (unicast)
    Source: Giga-Byt_0f:00:ad (00:24:1d:0f:00:ad)
        Address: Giga-Byt_0f:00:ad (00:24:1d:0f:00:ad)
        .... ..0. .... .... .... .... = LG bit: Globally unique address (factory default)
        .... ...0 .... .... .... .... = IG bit: Individual address (unicast)
    Type: IPv4 (0x0800)
Internet Protocol Version 4, Src: 59.233.235.218, Dst: 59.233.235.223
    0100 .... = Version: 4
    .... 0101 = Header Length: 20 bytes (5)
    Differentiated Services Field: 0x10 (DSCP: Unknown, ECN: Not-ECT)
        0001 00.. = Differentiated Services Codepoint: Unknown (4)
        .... ..00 = Explicit Congestion Notification: Not ECN-Capable Transport (0)
    Total Length: 60
    Identification: 0xa0e1 (41185)
    Flags: 0x4000, Don't fragment
        0... .... .... .... = Reserved bit: Not set
        .1.. .... .... .... = Don't fragment: Set
        ..0. .... .... .... = More fragments: Not set
        ...0 0000 0000 0000 = Fragment offset: 0
    Time to live: 64
    Protocol: TCP (6)
    Header checksum: 0x4a3e [validation disabled]
    [Header checksum status: Unverified]
    Source: 59.233.235.218
    Destination: 59.233.235.223
Transmission Control Protocol, Src Port: 39247, Dst Port: 12121, Seq: 0, Len: 0
    Source Port: 39247
    Destination Port: 12121
    [Stream index: 0]
    [TCP Segment Len: 0]
    Sequence number: 0    (relative sequence number)
    [Next sequence number: 0    (relative sequence number)]
    Acknowledgment number: 0
    1010 .... = Header Length: 40 bytes (10)
    Flags: 0x002 (SYN)
        000. .... .... = Reserved: Not set
        ...0 .... .... = Nonce: Not set
        .... 0... .... = Congestion Window Reduced (CWR): Not set
        .... .0.. .... = ECN-Echo: Not set
        .... ..0. .... = Urgent: Not set
        .... ...0 .... = Acknowledgment: Not set
        .... .... 0... = Push: Not set
        .... .... .0.. = Reset: Not set
        .... .... ..1. = Syn: Set
            [Expert Info (Chat/Sequence): Connection establish request (SYN): server port 12121]
                [Connection establish request (SYN): server port 12121]
                [Severity level: Chat]
                [Group: Sequence]
        .... .... ...0 = Fin: Not set
        [TCP Flags: ··········S·]
    Window size value: 14600
    [Calculated window size: 14600]
    Checksum: 0x8fad [unverified]
    [Checksum Status: Unverified]
    Urgent pointer: 0
    Options: (20 bytes), Maximum segment size, SACK permitted, Timestamps, No-Operation (NOP), Window scale
        TCP Option - Maximum segment size: 1460 bytes
            Kind: Maximum Segment Size (2)
            Length: 4
            MSS Value: 1460
        TCP Option - SACK permitted
            Kind: SACK Permitted (4)
            Length: 2
        TCP Option - Timestamps: TSval 18592800, TSecr 0
            Kind: Time Stamp Option (8)
            Length: 10
            Timestamp value: 18592800
            Timestamp echo reply: 0
        TCP Option - No-Operation (NOP)
            Kind: No-Operation (1)
        TCP Option - Window scale: 7 (multiply by 128)
            Kind: Window Scale (3)
            Length: 3
            Shift count: 7
            [Multiplier: 128]
    [Timestamps]
        [Time since first frame in this TCP stream: 0.000000000 seconds]
        [Time since previous frame in this TCP stream: 0.000000000 seconds]

Frame 2: 74 bytes on wire (592 bits), 74 bytes captured (592 bits)
    Encapsulation type: Ethernet (1)
    Arrival Time: Jul 20, 2011 07:23:12.267694000 CEST
    [Time shift for this packet: 0.000000000 seconds]
    Epoch Time: 1311139392.267694000 seconds
    [Time delta from previous captured frame: 0.000128000 seconds]
    [Time delta from previous displayed frame: 0.000128000 seconds]
    [Time since reference or first frame: 0.000128000 seconds]
    Frame Number: 2
    Frame Length: 74 bytes (592 bits)
    Capture Length: 74 bytes (592 bits)
    [Frame is marked: False]
    [Frame is ignored: False]
    [Protocols in frame: eth:ethertype:ip:tcp]
Ethernet II, Src: PcsCompu_cc:8a:1e (08:00:27:cc:8a:1e), Dst: Giga-Byt_0f:00:ad (00:24:1d:0f:00:ad)
    Destination: Giga-Byt_0f:00:ad (00:24:1d:0f:00:ad)
        Address: Giga-Byt_0f:00:ad (00:24:1d:0f:00:ad)
        .... ..0. .... .... .... .... = LG bit: Globally unique address (factory default)
        .... ...0 .... .... .... .... = IG bit: Individual address (unicast)
    Source: PcsCompu_cc:8a:1e (08:00:27:cc:8a:1e)
        Address: PcsCompu_cc:8a:1e (08:00:27:cc:8a:1e)
        .... ..0. .... .... .... .... = LG bit: Globally unique address (factory default)
        .... ...0 .... .... .... .... = IG bit: Individual address (unicast)
    Type: IPv4 (0x0800)
Internet Protocol Version 4, Src: 59.233.235.223, Dst: 59.233.235.218
    0100 .... = Version: 4
    .... 0101 = Header Length: 20 bytes (5)
    Differentiated Services Field: 0x00 (DSCP: CS0, ECN: Not-ECT)
        0000 00.. = Differentiated Services Codepoint: Default (0)
        .... ..00 = Explicit Congestion Notification: Not ECN-Capable Transport (0)
    Total Length: 60
    Identification: 0x0000 (0)
    Flags: 0x4000, Don't fragment
        0... .... .... .... = Reserved bit: Not set
        .1.. .... .... .... = Don't fragment: Set
        ..0. .... .... .... = More fragments: Not set
        ...0 0000 0000 0000 = Fragment offset: 0
    Time to live: 64
    Protocol: TCP (6)
    Header checksum: 0xeb2f [validation disabled]
    [Header checksum status: Unverified]
    Source: 59.233.235.223
    Destination: 59.233.235.218
Transmission Control Protocol, Src Port: 12121, Dst Port: 39247, Seq: 0, Ack: 1, Len: 0
    Source Port: 12121
    Destination Port: 39247
    [Stream index: 0]
    [TCP Segment Len: 0]
    Sequence number: 0    (relative sequence number)
    [Next sequence number: 0    (relative sequence number)]
    Acknowledgment number: 1    (relative ack number)
    1010 .... = Header Length: 40 bytes (10)
    Flags: 0x012 (SYN, ACK)
        000. .... .... = Reserved: Not set
        ...0 .... .... = Nonce: Not set
        .... 0... .... = Congestion Window Reduced (CWR): Not set
        .... .0.. .... = ECN-Echo: Not set
        .... ..0. .... = Urgent: Not set
        .... ...1 .... = Acknowledgment: Set
        .... .... 0... = Push: Not set
        .... .... .0.. = Reset: Not set
        .... .... ..1. = Syn: Set
            [Expert Info (Chat/Sequence): Connection establish acknowledge (SYN+ACK): server port 12121]
                [Connection establish acknowledge (SYN+ACK): server port 12121]
                [Severity level: Chat]
                [Group: Sequence]
        .... .... ...0 = Fin: Not set
        [TCP Flags: ·······A··S·]
    Window size value: 14480
    [Calculated window size: 14480]
    Checksum: 0xa988 [unverified]
    [Checksum Status: Unverified]
    Urgent pointer: 0
    Options: (20 bytes), Maximum segment size, SACK permitted, Timestamps, No-Operation (NOP), Window scale
        TCP Option - Maximum segment size: 1460 bytes
            Kind: Maximum Segment Size (2)
            Length: 4
            MSS Value: 1460
        TCP Option - SACK permitted
            Kind: SACK Permitted (4)
            Length: 2
        TCP Option - Timestamps: TSval 46280417, TSecr 18592800
            Kind: Time Stamp Option (8)
            Length: 10
            Timestamp value: 46280417
            Timestamp echo reply: 18592800
        TCP Option - No-Operation (NOP)
            Kind: No-Operation (1)
        TCP Option - Window scale: 5 (multiply by 32)
            Kind: Window Scale (3)
            Length: 3
            Shift count: 5
            [Multiplier: 32]
    [SEQ/ACK analysis]
        [This is an ACK to the segment in frame: 1]
        [The RTT to ACK the segment was: 0.000128000 seconds]
    [Timestamps]
        [Time since first frame in this TCP stream: 0.000128000 seconds]
        [Time since previous frame in this TCP stream: 0.000128000 seconds]

Frame 3: 66 bytes on wire (528 bits), 66 bytes captured (528 bits)
    Encapsulation type: Ethernet (1)
    Arrival Time: Jul 20, 2011 07:23:12.267956000 CEST
    [Time shift for this packet: 0.000000000 seconds]
    Epoch Time: 1311139392.267956000 seconds
    [Time delta from previous captured frame: 0.000262000 seconds]
    [Time delta from previous displayed frame: 0.000262000 seconds]
    [Time since reference or first frame: 0.000390000 seconds]
    Frame Number: 3
    Frame Length: 66 bytes (528 bits)
    Capture Length: 66 bytes (528 bits)
    [Frame is marked: False]
    [Frame is ignored: False]
    [Protocols in frame: eth:ethertype:ip:tcp]
Ethernet II, Src: Giga-Byt_0f:00:ad (00:24:1d:0f:00:ad), Dst: PcsCompu_cc:8a:1e (08:00:27:cc:8a:1e)
    Destination: PcsCompu_cc:8a:1e (08:00:27:cc:8a:1e)
        Address: PcsCompu_cc:8a:1e (08:00:27:cc:8a:1e)
        .... ..0. .... .... .... .... = LG bit: Globally unique address (factory default)
        .... ...0 .... .... .... .... = IG bit: Individual address (unicast)
    Source: Giga-Byt_0f:00:ad (00:24:1d:0f:00:ad)
        Address: Giga-Byt_0f:00:ad (00:24:1d:0f:00:ad)
        .... ..0. .... .... .... .... = LG bit: Globally unique address (factory default)
        .... ...0 .... .... .... .... = IG bit: Individual address (unicast)
    Type: IPv4 (0x0800)
Internet Protocol Version 4, Src: 59.233.235.218, Dst: 59.233.235.223
    0100 .... = Version: 4
    .... 0101 = Header Length: 20 bytes (5)
    Differentiated Services Field: 0x10 (DSCP: Unknown, ECN: Not-ECT)
        0001 00.. = Differentiated Services Codepoint: Unknown (4)
        .... ..00 = Explicit Congestion Notification: Not ECN-Capable Transport (0)
    Total Length: 52
    Identification: 0xa0e2 (41186)
    Flags: 0x4000, Don't fragment
        0... .... .... .... = Reserved bit: Not set
        .1.. .... .... .... = Don't fragment: Set
        ..0. .... .... .... = More fragments: Not set
        ...0 0000 0000 0000 = Fragment offset: 0
    Time to live: 64
    Protocol: TCP (6)
    Header checksum: 0x4a45 [validation disabled]
    [Header checksum status: Unverified]
    Source: 59.233.235.218
    Destination: 59.233.235.223
Transmission Control Protocol, Src Port: 39247, Dst Port: 12121, Seq: 1, Ack: 1, Len: 0
    Source Port: 39247
    Destination Port: 12121
    [Stream index: 0]
    [TCP Segment Len: 0]
    Sequence number: 1    (relative sequence number)
    [Next sequence number: 1    (relative sequence number)]
    Acknowledgment number: 1    (relative ack number)
    1000 .... = Header Length: 32 bytes (8)
    Flags: 0x010 (ACK)
        000. .... .... = Reserved: Not set
        ...0 .... .... = Nonce: Not set
        .... 0... .... = Congestion Window Reduced (CWR): Not set
        .... .0.. .... = ECN-Echo: Not set
        .... ..0. .... = Urgent: Not set
        .... ...1 .... = Acknowledgment: Set
        .... .... 0... = Push: Not set
        .... .... .0.. = Reset: Not set
        .... .... ..0. = Syn: Not set
        .... .... ...0 = Fin: Not set
        [TCP Flags: ·······A····]
    Window size value: 115
    [Calculated window size: 14720]
    [Window size scaling factor: 128]
    Checksum: 0x1070 [unverified]
    [Checksum Status: Unverified]
    Urgent pointer: 0
    Options: (12 bytes), No-Operation (NOP), No-Operation (NOP), Timestamps
        TCP Option - No-Operation (NOP)
            Kind: No-Operation (1)
        TCP Option - No-Operation (NOP)
            Kind: No-Operation (1)
        TCP Option - Timestamps: TSval 18592800, TSecr 46280417
            Kind: Time Stamp Option (8)
            Length: 10
            Timestamp value: 18592800
            Timestamp echo reply: 46280417
    [SEQ/ACK analysis]
        [This is an ACK to the segment in frame: 2]
        [The RTT to ACK the segment was: 0.000262000 seconds]
        [iRTT: 0.000390000 seconds]
    [Timestamps]
        [Time since first frame in this TCP stream: 0.000390000 seconds]
        [Time since previous frame in this TCP stream: 0.000262000 seconds]

Frame 4: 69 bytes on wire (552 bits), 69 bytes captured (552 bits)
    Encapsulation type: Ethernet (1)
    Arrival Time: Jul 20, 2011 07:23:12.303574000 CEST
    [Time shift for this packet: 0.000000000 seconds]
    Epoch Time: 1311139392.303574000 seconds
    [Time delta from previous captured frame: 0.035618000 seconds]
    [Time delta from previous displayed frame: 0.035618000 seconds]
    [Time since reference or first frame: 0.036008000 seconds]
    Frame Number: 4
    Frame Length: 69 bytes (552 bits)
    Capture Length: 69 bytes (552 bits)
    [Frame is marked: False]
    [Frame is ignored: False]
    [Protocols in frame: eth:ethertype:ip:tcp:data]
Ethernet II, Src: PcsCompu_cc:8a:1e (08:00:27:cc:8a:1e), Dst: Giga-Byt_0f:00:ad (00:24:1d:0f:00:ad)
    Destination: Giga-Byt_0f:00:ad (00:24:1d:0f:00:ad)
        Address: Giga-Byt_0f:00:ad (00:24:1d:0f:00:ad)
        .... ..0. .... .... .... .... = LG bit: Globally unique address (factory default)
        .... ...0 .... .... .... .... = IG bit: Individual address (unicast)
    Source: PcsCompu_cc:8a:1e (08:00:27:cc:8a:1e)
        Address: PcsCompu_cc:8a:1e (08:00:27:cc:8a:1e)
        .... ..0. .... .... .... .... = LG bit: Globally unique address (factory default)
        .... ...0 .... .... .... .... = IG bit: Individual address (unicast)
    Type: IPv4 (0x0800)
Internet Protocol Version 4, Src: 59.233.235.223, Dst: 59.233.235.218
    0100 .... = Version: 4
    .... 0101 = Header Length: 20 bytes (5)
    Differentiated Services Field: 0x00 (DSCP: CS0, ECN: Not-ECT)
        0000 00.. = Differentiated Services Codepoint: Default (0)
        .... ..00 = Explicit Congestion Notification: Not ECN-Capable Transport (0)
    Total Length: 55
    Identification: 0xd4a3 (54435)
    Flags: 0x4000, Don't fragment
        0... .... .... .... = Reserved bit: Not set
        .1.. .... .... .... = Don't fragment: Set
        ..0. .... .... .... = More fragments: Not set
        ...0 0000 0000 0000 = Fragment offset: 0
    Time to live: 64
    Protocol: TCP (6)
    Header checksum: 0x1691 [validation disabled]
    [Header checksum status: Unverified]
    Source: 59.233.235.223
    Destination: 59.233.235.218
Transmission Control Protocol, Src Port: 12121, Dst Port: 39247, Seq: 1, Ack: 1, Len: 3
    Source Port: 12121
    Destination Port: 39247
    [Stream index: 0]
    [TCP Segment Len: 3]
    Sequence number: 1    (relative sequence number)
    [Next sequence number: 4    (relative sequence number)]
    Acknowledgment number: 1    (relative ack number)
    1000 .... = Header Length: 32 bytes (8)
    Flags: 0x018 (PSH, ACK)
        000. .... .... = Reserved: Not set
        ...0 .... .... = Nonce: Not set
        .... 0... .... = Congestion Window Reduced (CWR): Not set
        .... .0.. .... = ECN-Echo: Not set
        .... ..0. .... = Urgent: Not set
        .... ...1 .... = Acknowledgment: Set
        .... .... 1... = Push: Set
        .... .... .0.. = Reset: Not set
        .... .... ..0. = Syn: Not set
        .... .... ...0 = Fin: Not set
        [TCP Flags: ·······AP···]
    Window size value: 453
    [Calculated window size: 14496]
    [Window size scaling factor: 32]
    Checksum: 0xea0b [unverified]
    [Checksum Status: Unverified]
    Urgent pointer: 0
    Options: (12 bytes), No-Operation (NOP), No-Operation (NOP), Timestamps
        TCP Option - No-Operation (NOP)
            Kind: No-Operation (1)
        TCP Option - No-Operation (NOP)
            Kind: No-Operation (1)
        TCP Option - Timestamps: TSval 46280426, TSecr 18592800
            Kind: Time Stamp Option (8)
            Length: 10
            Timestamp value: 46280426
            Timestamp echo reply: 18592800
    [SEQ/ACK analysis]
        [iRTT: 0.000390000 seconds]
        [Bytes in flight: 3]
        [Bytes sent since last PSH flag: 3]
    [Timestamps]
        [Time since first frame in this TCP stream: 0.036008000 seconds]
        [Time since previous frame in this TCP stream: 0.035618000 seconds]
    TCP payload (3 bytes)
Data (3 bytes)

0000  ff fd 25                                          ..%
    Data: fffd25
    [Length: 3]

Frame 5: 66 bytes on wire (528 bits), 66 bytes captured (528 bits)
    Encapsulation type: Ethernet (1)
    Arrival Time: Jul 20, 2011 07:23:12.303821000 CEST
    [Time shift for this packet: 0.000000000 seconds]
    Epoch Time: 1311139392.303821000 seconds
    [Time delta from previous captured frame: 0.000247000 seconds]
    [Time delta from previous displayed frame: 0.000247000 seconds]
    [Time since reference or first frame: 0.036255000 seconds]
    Frame Number: 5
    Frame Length: 66 bytes (528 bits)
    Capture Length: 66 bytes (528 bits)
    [Frame is marked: False]
    [Frame is ignored: False]
    [Protocols in frame: eth:ethertype:ip:tcp]
Ethernet II, Src: Giga-Byt_0f:00:ad (00:24:1d:0f:00:ad), Dst: PcsCompu_cc:8a:1e (08:00:27:cc:8a:1e)
    Destination: PcsCompu_cc:8a:1e (08:00:27:cc:8a:1e)
        Address: PcsCompu_cc:8a:1e (08:00:27:cc:8a:1e)
        .... ..0. .... .... .... .... = LG bit: Globally unique address (factory default)
        .... ...0 .... .... .... .... = IG bit: Individual address (unicast)
    Source: Giga-Byt_0f:00:ad (00:24:1d:0f:00:ad)
        Address: Giga-Byt_0f:00:ad (00:24:1d:0f:00:ad)
        .... ..0. .... .... .... .... = LG bit: Globally unique address (factory default)
        .... ...0 .... .... .... .... = IG bit: Individual address (unicast)
    Type: IPv4 (0x0800)
Internet Protocol Version 4, Src: 59.233.235.218, Dst: 59.233.235.223
    0100 .... = Version: 4
    .... 0101 = Header Length: 20 bytes (5)
    Differentiated Services Field: 0x10 (DSCP: Unknown, ECN: Not-ECT)
        0001 00.. = Differentiated Services Codepoint: Unknown (4)
        .... ..00 = Explicit Congestion Notification: Not ECN-Capable Transport (0)
    Total Length: 52
    Identification: 0xa0e3 (41187)
    Flags: 0x4000, Don't fragment
        0... .... .... .... = Reserved bit: Not set
        .1.. .... .... .... = Don't fragment: Set
        ..0. .... .... .... = More fragments: Not set
        ...0 0000 0000 0000 = Fragment offset: 0
    Time to live: 64
    Protocol: TCP (6)
    Header checksum: 0x4a44 [validation disabled]
    [Header checksum status: Unverified]
    Source: 59.233.235.218
    Destination: 59.233.235.223
Transmission Control Protocol, Src Port: 39247, Dst Port: 12121, Seq: 1, Ack: 4, Len: 0
    Source Port: 39247
    Destination Port: 12121
    [Stream index: 0]
    [TCP Segment Len: 0]
    Sequence number: 1    (relative sequence number)
    [Next sequence number: 1    (relative sequence number)]
    Acknowledgment number: 4    (relative ack number)
    1000 .... = Header Length: 32 bytes (8)
    Flags: 0x010 (ACK)
        000. .... .... = Reserved: Not set
        ...0 .... .... = Nonce: Not set
        .... 0... .... = Congestion Window Reduced (CWR): Not set
        .... .0.. .... = ECN-Echo: Not set
        .... ..0. .... = Urgent: Not set
        .... ...1 .... = Acknowledgment: Set
        .... .... 0... = Push: Not set
        .... .... .0.. = Reset: Not set
        .... .... ..0. = Syn: Not set
        .... .... ...0 = Fin: Not set
        [TCP Flags: ·······A····]
    Window size value: 115
    [Calculated window size: 14720]
    [Window size scaling factor: 128]
    Checksum: 0x1060 [unverified]
    [Checksum Status: Unverified]
    Urgent pointer: 0
    Options: (12 bytes), No-Operation (NOP), No-Operation (NOP), Timestamps
        TCP Option - No-Operation (NOP)
            Kind: No-Operation (1)
        TCP Option - No-Operation (NOP)
            Kind: No-Operation (1)
        TCP Option - Timestamps: TSval 18592804, TSecr 46280426
            Kind: Time Stamp Option (8)
            Length: 10
            Timestamp value: 18592804
            Timestamp echo reply: 46280426
    [SEQ/ACK analysis]
        [This is an ACK to the segment in frame: 4]
        [The RTT to ACK the segment was: 0.000247000 seconds]
        [iRTT: 0.000390000 seconds]
    [Timestamps]
        [Time since first frame in this TCP stream: 0.036255000 seconds]
        [Time since previous frame in this TCP stream: 0.000247000 seconds]

Frame 6: 69 bytes on wire (552 bits), 69 bytes captured (552 bits)
    Encapsulation type: Ethernet (1)
    Arrival Time: Jul 20, 2011 07:23:12.303842000 CEST
    [Time shift for this packet: 0.000000000 seconds]
    Epoch Time: 1311139392.303842000 seconds
    [Time delta from previous captured frame: 0.000021000 seconds]
    [Time delta from previous displayed frame: 0.000021000 seconds]
    [Time since reference or first frame: 0.036276000 seconds]
    Frame Number: 6
    Frame Length: 69 bytes (552 bits)
    Capture Length: 69 bytes (552 bits)
    [Frame is marked: False]
    [Frame is ignored: False]
    [Protocols in frame: eth:ethertype:ip:tcp:data]
Ethernet II, Src: Giga-Byt_0f:00:ad (00:24:1d:0f:00:ad), Dst: PcsCompu_cc:8a:1e (08:00:27:cc:8a:1e)
    Destination: PcsCompu_cc:8a:1e (08:00:27:cc:8a:1e)
        Address: PcsCompu_cc:8a:1e (08:00:27:cc:8a:1e)
        .... ..0. .... .... .... .... = LG bit: Globally unique address (factory default)
        .... ...0 .... .... .... .... = IG bit: Individual address (unicast)
    Source: Giga-Byt_0f:00:ad (00:24:1d:0f:00:ad)
        Address: Giga-Byt_0f:00:ad (00:24:1d:0f:00:ad)
        .... ..0. .... .... .... .... = LG bit: Globally unique address (factory default)
        .... ...0 .... .... .... .... = IG bit: Individual address (unicast)
    Type: IPv4 (0x0800)
Internet Protocol Version 4, Src: 59.233.235.218, Dst: 59.233.235.223
    0100 .... = Version: 4
    .... 0101 = Header Length: 20 bytes (5)
    Differentiated Services Field: 0x10 (DSCP: Unknown, ECN: Not-ECT)
        0001 00.. = Differentiated Services Codepoint: Unknown (4)
        .... ..00 = Explicit Congestion Notification: Not ECN-Capable Transport (0)
    Total Length: 55
    Identification: 0xa0e4 (41188)
    Flags: 0x4000, Don't fragment
        0... .... .... .... = Reserved bit: Not set
        .1.. .... .... .... = Don't fragment: Set
        ..0. .... .... .... = More fragments: Not set
        ...0 0000 0000 0000 = Fragment offset: 0
    Time to live: 64
    Protocol: TCP (6)
    Header checksum: 0x4a40 [validation disabled]
    [Header checksum status: Unverified]
    Source: 59.233.235.218
    Destination: 59.233.235.223
Transmission Control Protocol, Src Port: 39247, Dst Port: 12121, Seq: 1, Ack: 4, Len: 3
    Source Port: 39247
    Destination Port: 12121
    [Stream index: 0]
    [TCP Segment Len: 3]
    Sequence number: 1    (relative sequence number)
    [Next sequence number: 4    (relative sequence number)]
    Acknowledgment number: 4    (relative ack number)
    1000 .... = Header Length: 32 bytes (8)
    Flags: 0x018 (PSH, ACK)
        000. .... .... = Reserved: Not set
        ...0 .... .... = Nonce: Not set
        .... 0... .... = Congestion Window Reduced (CWR): Not set
        .... .0.. .... = ECN-Echo: Not set
        .... ..0. .... = Urgent: Not set
        .... ...1 .... = Acknowledgment: Set
        .... .... 1... = Push: Set
        .... .... .0.. = Reset: Not set
        .... .... ..0. = Syn: Not set
        .... .... ...0 = Fin: Not set
        [TCP Flags: ·······AP···]
    Window size value: 115
    [Calculated window size: 14720]
    [Window size scaling factor: 128]
    Checksum: 0xeb57 [unverified]
    [Checksum Status: Unverified]
    Urgent pointer: 0
    Options: (12 bytes), No-Operation (NOP), No-Operation (NOP), Timestamps
        TCP Option - No-Operation (NOP)
            Kind: No-Operation (1)
        TCP Option - No-Operation (NOP)
            Kind: No-Operation (1)
        TCP Option - Timestamps: TSval 18592804, TSecr 46280426
            Kind: Time Stamp Option (8)
            Length: 10
            Timestamp value: 18592804
            Timestamp echo reply: 46280426
    [SEQ/ACK analysis]
        [iRTT: 0.000390000 seconds]
        [Bytes in flight: 3]
        [Bytes sent since last PSH flag: 3]
    [Timestamps]
        [Time since first frame in this TCP stream: 0.036276000 seconds]
        [Time since previous frame in this TCP stream: 0.000021000 seconds]
    TCP payload (3 bytes)
Data (3 bytes)

0000  ff fc 25                                          ..%
    Data: fffc25
    [Length: 3]

Frame 7: 66 bytes on wire (528 bits), 66 bytes captured (528 bits)
    Encapsulation type: Ethernet (1)
    Arrival Time: Jul 20, 2011 07:23:12.303962000 CEST
    [Time shift for this packet: 0.000000000 seconds]
    Epoch Time: 1311139392.303962000 seconds
    [Time delta from previous captured frame: 0.000120000 seconds]
    [Time delta from previous displayed frame: 0.000120000 seconds]
    [Time since reference or first frame: 0.036396000 seconds]
    Frame Number: 7
    Frame Length: 66 bytes (528 bits)
    Capture Length: 66 bytes (528 bits)
    [Frame is marked: False]
    [Frame is ignored: False]
    [Protocols in frame: eth:ethertype:ip:tcp]
Ethernet II, Src: PcsCompu_cc:8a:1e (08:00:27:cc:8a:1e), Dst: Giga-Byt_0f:00:ad (00:24:1d:0f:00:ad)
    Destination: Giga-Byt_0f:00:ad (00:24:1d:0f:00:ad)
        Address: Giga-Byt_0f:00:ad (00:24:1d:0f:00:ad)
        .... ..0. .... .... .... .... = LG bit: Globally unique address (factory default)
        .... ...0 .... .... .... .... = IG bit: Individual address (unicast)
    Source: PcsCompu_cc:8a:1e (08:00:27:cc:8a:1e)
        Address: PcsCompu_cc:8a:1e (08:00:27:cc:8a:1e)
        .... ..0. .... .... .... .... = LG bit: Globally unique address (factory default)
        .... ...0 .... .... .... .... = IG bit: Individual address (unicast)
    Type: IPv4 (0x0800)
Internet Protocol Version 4, Src: 59.233.235.223, Dst: 59.233.235.218
    0100 .... = Version: 4
    .... 0101 = Header Length: 20 bytes (5)
    Differentiated Services Field: 0x00 (DSCP: CS0, ECN: Not-ECT)
        0000 00.. = Differentiated Services Codepoint: Default (0)
        .... ..00 = Explicit Congestion Notification: Not ECN-Capable Transport (0)
    Total Length: 52
    Identification: 0xd4a4 (54436)
    Flags: 0x4000, Don't fragment
        0... .... .... .... = Reserved bit: Not set
        .1.. .... .... .... = Don't fragment: Set
        ..0. .... .... .... = More fragments: Not set
        ...0 0000 0000 0000 = Fragment offset: 0
    Time to live: 64
    Protocol: TCP (6)
    Header checksum: 0x1693 [validation disabled]
    [Header checksum status: Unverified]
    Source: 59.233.235.223
    Destination: 59.233.235.218
Transmission Control Protocol, Src Port: 12121, Dst Port: 39247, Seq: 4, Ack: 4, Len: 0
    Source Port: 12121
    Destination Port: 39247
    [Stream index: 0]
    [TCP Segment Len: 0]
    Sequence number: 4    (relative sequence number)
    [Next sequence number: 4    (relative sequence number)]
    Acknowledgment number: 4    (relative ack number)
    1000 .... = Header Length: 32 bytes (8)
    Flags: 0x010 (ACK)
        000. .... .... = Reserved: Not set
        ...0 .... .... = Nonce: Not set
        .... 0... .... = Congestion Window Reduced (CWR): Not set
        .... .0.. .... = ECN-Echo: Not set
        .... ..0. .... = Urgent: Not set
        .... ...1 .... = Acknowledgment: Set
        .... .... 0... = Push: Not set
        .... .... .0.. = Reset: Not set
        .... .... ..0. = Syn: Not set
        .... .... ...0 = Fin: Not set
        [TCP Flags: ·······A····]
    Window size value: 453
    [Calculated window size: 14496]
    [Window size scaling factor: 32]
    Checksum: 0x0f0b [unverified]
    [Checksum Status: Unverified]
    Urgent pointer: 0
    Options: (12 bytes), No-Operation (NOP), No-Operation (NOP), Timestamps
        TCP Option - No-Operation (NOP)
            Kind: No-Operation (1)
        TCP Option - No-Operation (NOP)
            Kind: No-Operation (1)
        TCP Option - Timestamps: TSval 46280426, TSecr 18592804
            Kind: Time Stamp Option (8)
            Length: 10
            Timestamp value: 46280426
            Timestamp echo reply: 18592804
    [SEQ/ACK analysis]
        [This is an ACK to the segment in frame: 6]
        [The RTT to ACK the segment was: 0.000120000 seconds]
        [iRTT: 0.000390000 seconds]
    [Timestamps]
        [Time since first frame in this TCP stream: 0.036396000 seconds]
        [Time since previous frame in this TCP stream: 0.000120000 seconds]

Frame 8: 84 bytes on wire (672 bits), 84 bytes captured (672 bits)
    Encapsulation type: Ethernet (1)
    Arrival Time: Jul 20, 2011 07:23:12.304147000 CEST
    [Time shift for this packet: 0.000000000 seconds]
    Epoch Time: 1311139392.304147000 seconds
    [Time delta from previous captured frame: 0.000185000 seconds]
    [Time delta from previous displayed frame: 0.000185000 seconds]
    [Time since reference or first frame: 0.036581000 seconds]
    Frame Number: 8
    Frame Length: 84 bytes (672 bits)
    Capture Length: 84 bytes (672 bits)
    [Frame is marked: False]
    [Frame is ignored: False]
    [Protocols in frame: eth:ethertype:ip:tcp:data]
Ethernet II, Src: PcsCompu_cc:8a:1e (08:00:27:cc:8a:1e), Dst: Giga-Byt_0f:00:ad (00:24:1d:0f:00:ad)
    Destination: Giga-Byt_0f:00:ad (00:24:1d:0f:00:ad)
        Address: Giga-Byt_0f:00:ad (00:24:1d:0f:00:ad)
        .... ..0. .... .... .... .... = LG bit: Globally unique address (factory default)
        .... ...0 .... .... .... .... = IG bit: Individual address (unicast)
    Source: PcsCompu_cc:8a:1e (08:00:27:cc:8a:1e)
        Address: PcsCompu_cc:8a:1e (08:00:27:cc:8a:1e)
        .... ..0. .... .... .... .... = LG bit: Globally unique address (factory default)
        .... ...0 .... .... .... .... = IG bit: Individual address (unicast)
    Type: IPv4 (0x0800)
Internet Protocol Version 4, Src: 59.233.235.223, Dst: 59.233.235.218
    0100 .... = Version: 4
    .... 0101 = Header Length: 20 bytes (5)
    Differentiated Services Field: 0x00 (DSCP: CS0, ECN: Not-ECT)
        0000 00.. = Differentiated Services Codepoint: Default (0)
        .... ..00 = Explicit Congestion Notification: Not ECN-Capable Transport (0)
    Total Length: 70
    Identification: 0xd4a5 (54437)
    Flags: 0x4000, Don't fragment
        0... .... .... .... = Reserved bit: Not set
        .1.. .... .... .... = Don't fragment: Set
        ..0. .... .... .... = More fragments: Not set
        ...0 0000 0000 0000 = Fragment offset: 0
    Time to live: 64
    Protocol: TCP (6)
    Header checksum: 0x1680 [validation disabled]
    [Header checksum status: Unverified]
    Source: 59.233.235.223
    Destination: 59.233.235.218
Transmission Control Protocol, Src Port: 12121, Dst Port: 39247, Seq: 4, Ack: 4, Len: 18
    Source Port: 12121
    Destination Port: 39247
    [Stream index: 0]
    [TCP Segment Len: 18]
    Sequence number: 4    (relative sequence number)
    [Next sequence number: 22    (relative sequence number)]
    Acknowledgment number: 4    (relative ack number)
    1000 .... = Header Length: 32 bytes (8)
    Flags: 0x018 (PSH, ACK)
        000. .... .... = Reserved: Not set
        ...0 .... .... = Nonce: Not set
        .... 0... .... = Congestion Window Reduced (CWR): Not set
        .... .0.. .... = ECN-Echo: Not set
        .... ..0. .... = Urgent: Not set
        .... ...1 .... = Acknowledgment: Set
        .... .... 1... = Push: Set
        .... .... .0.. = Reset: Not set
        .... .... ..0. = Syn: Not set
        .... .... ...0 = Fin: Not set
        [TCP Flags: ·······AP···]
    Window size value: 453
    [Calculated window size: 14496]
    [Window size scaling factor: 32]
    Checksum: 0xa799 [unverified]
    [Checksum Status: Unverified]
    Urgent pointer: 0
    Options: (12 bytes), No-Operation (NOP), No-Operation (NOP), Timestamps
        TCP Option - No-Operation (NOP)
            Kind: No-Operation (1)
        TCP Option - No-Operation (NOP)
            Kind: No-Operation (1)
        TCP Option - Timestamps: TSval 46280426, TSecr 18592804
            Kind: Time Stamp Option (8)
            Length: 10
            Timestamp value: 46280426
            Timestamp echo reply: 18592804
    [SEQ/ACK analysis]
        [iRTT: 0.000390000 seconds]
        [Bytes in flight: 18]
        [Bytes sent since last PSH flag: 18]
    [Timestamps]
        [Time since first frame in this TCP stream: 0.036581000 seconds]
        [Time since previous frame in this TCP stream: 0.000185000 seconds]
    TCP payload (18 bytes)
Data (18 bytes)

0000  ff fb 26 ff fd 18 ff fd 20 ff fd 23 ff fd 27 ff   ..&..... ..#..'.
0010  fd 24                                             .$
    Data: fffb26fffd18fffd20fffd23fffd27fffd24
    [Length: 18]

Frame 9: 84 bytes on wire (672 bits), 84 bytes captured (672 bits)
    Encapsulation type: Ethernet (1)
    Arrival Time: Jul 20, 2011 07:23:12.304264000 CEST
    [Time shift for this packet: 0.000000000 seconds]
    Epoch Time: 1311139392.304264000 seconds
    [Time delta from previous captured frame: 0.000117000 seconds]
    [Time delta from previous displayed frame: 0.000117000 seconds]
    [Time since reference or first frame: 0.036698000 seconds]
    Frame Number: 9
    Frame Length: 84 bytes (672 bits)
    Capture Length: 84 bytes (672 bits)
    [Frame is marked: False]
    [Frame is ignored: False]
    [Protocols in frame: eth:ethertype:ip:tcp:data]
Ethernet II, Src: Giga-Byt_0f:00:ad (00:24:1d:0f:00:ad), Dst: PcsCompu_cc:8a:1e (08:00:27:cc:8a:1e)
    Destination: PcsCompu_cc:8a:1e (08:00:27:cc:8a:1e)
        Address: PcsCompu_cc:8a:1e (08:00:27:cc:8a:1e)
        .... ..0. .... .... .... .... = LG bit: Globally unique address (factory default)
        .... ...0 .... .... .... .... = IG bit: Individual address (unicast)
    Source: Giga-Byt_0f:00:ad (00:24:1d:0f:00:ad)
        Address: Giga-Byt_0f:00:ad (00:24:1d:0f:00:ad)
        .... ..0. .... .... .... .... = LG bit: Globally unique address (factory default)
        .... ...0 .... .... .... .... = IG bit: Individual address (unicast)
    Type: IPv4 (0x0800)
Internet Protocol Version 4, Src: 59.233.235.218, Dst: 59.233.235.223
    0100 .... = Version: 4
    .... 0101 = Header Length: 20 bytes (5)
    Differentiated Services Field: 0x10 (DSCP: Unknown, ECN: Not-ECT)
        0001 00.. = Differentiated Services Codepoint: Unknown (4)
        .... ..00 = Explicit Congestion Notification: Not ECN-Capable Transport (0)
    Total Length: 70
    Identification: 0xa0e5 (41189)
    Flags: 0x4000, Don't fragment
        0... .... .... .... = Reserved bit: Not set
        .1.. .... .... .... = Don't fragment: Set
        ..0. .... .... .... = More fragments: Not set
        ...0 0000 0000 0000 = Fragment offset: 0
    Time to live: 64
    Protocol: TCP (6)
    Header checksum: 0x4a30 [validation disabled]
    [Header checksum status: Unverified]
    Source: 59.233.235.218
    Destination: 59.233.235.223
Transmission Control Protocol, Src Port: 39247, Dst Port: 12121, Seq: 4, Ack: 22, Len: 18
    Source Port: 39247
    Destination Port: 12121
    [Stream index: 0]
    [TCP Segment Len: 18]
    Sequence number: 4    (relative sequence number)
    [Next sequence number: 22    (relative sequence number)]
    Acknowledgment number: 22    (relative ack number)
    1000 .... = Header Length: 32 bytes (8)
    Flags: 0x018 (PSH, ACK)
        000. .... .... = Reserved: Not set
        ...0 .... .... = Nonce: Not set
        .... 0... .... = Congestion Window Reduced (CWR): Not set
        .... .0.. .... = ECN-Echo: Not set
        .... ..0. .... = Urgent: Not set
        .... ...1 .... = Acknowledgment: Set
        .... .... 1... = Push: Set
        .... .... .0.. = Reset: Not set
        .... .... ..0. = Syn: Not set
        .... .... ...0 = Fin: Not set
        [TCP Flags: ·······AP···]
    Window size value: 115
    [Calculated window size: 14720]
    [Window size scaling factor: 128]
    Checksum: 0xadda [unverified]
    [Checksum Status: Unverified]
    Urgent pointer: 0
    Options: (12 bytes), No-Operation (NOP), No-Operation (NOP), Timestamps
        TCP Option - No-Operation (NOP)
            Kind: No-Operation (1)
        TCP Option - No-Operation (NOP)
            Kind: No-Operation (1)
        TCP Option - Timestamps: TSval 18592804, TSecr 46280426
            Kind: Time Stamp Option (8)
            Length: 10
            Timestamp value: 18592804
            Timestamp echo reply: 46280426
    [SEQ/ACK analysis]
        [This is an ACK to the segment in frame: 8]
        [The RTT to ACK the segment was: 0.000117000 seconds]
        [iRTT: 0.000390000 seconds]
        [Bytes in flight: 18]
        [Bytes sent since last PSH flag: 18]
    [Timestamps]
        [Time since first frame in this TCP stream: 0.036698000 seconds]
        [Time since previous frame in this TCP stream: 0.000117000 seconds]
    TCP payload (18 bytes)
Data (18 bytes)

0000  ff fe 26 ff fb 18 ff fb 20 ff fb 23 ff fb 27 ff   ..&..... ..#..'.
0010  fc 24                                             .$
    Data: fffe26fffb18fffb20fffb23fffb27fffc24
    [Length: 18]

Frame 10: 90 bytes on wire (720 bits), 90 bytes captured (720 bits)
    Encapsulation type: Ethernet (1)
    Arrival Time: Jul 20, 2011 07:23:12.304425000 CEST
    [Time shift for this packet: 0.000000000 seconds]
    Epoch Time: 1311139392.304425000 seconds
    [Time delta from previous captured frame: 0.000161000 seconds]
    [Time delta from previous displayed frame: 0.000161000 seconds]
    [Time since reference or first frame: 0.036859000 seconds]
    Frame Number: 10
    Frame Length: 90 bytes (720 bits)
    Capture Length: 90 bytes (720 bits)
    [Frame is marked: False]
    [Frame is ignored: False]
    [Protocols in frame: eth:ethertype:ip:tcp:data]
Ethernet II, Src: PcsCompu_cc:8a:1e (08:00:27:cc:8a:1e), Dst: Giga-Byt_0f:00:ad (00:24:1d:0f:00:ad)
    Destination: Giga-Byt_0f:00:ad (00:24:1d:0f:00:ad)
        Address: Giga-Byt_0f:00:ad (00:24:1d:0f:00:ad)
        .... ..0. .... .... .... .... = LG bit: Globally unique address (factory default)
        .... ...0 .... .... .... .... = IG bit: Individual address (unicast)
    Source: PcsCompu_cc:8a:1e (08:00:27:cc:8a:1e)
        Address: PcsCompu_cc:8a:1e (08:00:27:cc:8a:1e)
        .... ..0. .... .... .... .... = LG bit: Globally unique address (factory default)
        .... ...0 .... .... .... .... = IG bit: Individual address (unicast)
    Type: IPv4 (0x0800)
Internet Protocol Version 4, Src: 59.233.235.223, Dst: 59.233.235.218
    0100 .... = Version: 4
    .... 0101 = Header Length: 20 bytes (5)
    Differentiated Services Field: 0x00 (DSCP: CS0, ECN: Not-ECT)
        0000 00.. = Differentiated Services Codepoint: Default (0)
        .... ..00 = Explicit Congestion Notification: Not ECN-Capable Transport (0)
    Total Length: 76
    Identification: 0xd4a6 (54438)
    Flags: 0x4000, Don't fragment
        0... .... .... .... = Reserved bit: Not set
        .1.. .... .... .... = Don't fragment: Set
        ..0. .... .... .... = More fragments: Not set
        ...0 0000 0000 0000 = Fragment offset: 0
    Time to live: 64
    Protocol: TCP (6)
